{
  "draft": {
    "source_pdf": "source/The_Greatest_Shortcoming-1.pdf",
    "version": 1,
    "pages": 103,
    "sha256": "c65250f6f2c71ef161997d21918eeb5dd30f5697e9d1bc867f6d312d298a784b",
    "ingested": "2026-06-07",
    "title_line": "Quantitative Chauvinism and Lebensraum Imaginaries"
  },

  "constructs": [
    {
      "id": "quant_chauvinism",
      "canonical_name": "Quantitative Chauvinism",
      "slug": "quant-chauvinism",
      "short_label": "QC",
      "aliases_deprecated": [],
      "preserve_terms": [],
      "definition": "A style of reasoning that privileges quantitative metrics as having jurisdiction over political judgments, collapses heterogeneous social complexity into a single aggregated trajectory, and then inscribes the result in portable artifacts that travel as if they were neutral facts — using numerical abstractions to close political questions before they can be opened.",
      "status": "unchanged"
    },
    {
      "id": "lebensraum_imaginary",
      "prev_id": "ecofascist_imaginary",
      "canonical_name": "Lebensraum Imaginaries",
      "prev_name": "Ecofascist Imaginaries",
      "slug": "lebensraum-imaginaries",
      "prev_slug": "ecofascist-imaginaries",
      "short_label": "LI",
      "prev_short_label": "EFI",
      "aliases_deprecated": [
        "Ecofascist Imaginaries",
        "ecofascist imaginaries",
        "Ecofascist imaginaries",
        "Eco-fascist Imaginaries",
        "eco-fascist imaginaries",
        "Eco-fascist Imaginary",
        "eco-fascist imaginary"
      ],
      "preserve_terms": ["ecofascism", "ecofascist"],
      "definition": "A recurring epistemic architecture within ecofascism: an ensemble of future narratives, organizational practices, and rhetorical repertoires through which ecological emergency is converted into demographic hierarchy and coercive governance is presented as reluctant but responsible management of natural limits. Lebensraum is a deliberate reference to a concept crossing biological, ecological, social, and political boundaries — one that animated the calamities of the Third Reich but has a longer history and more unsettling afterlives.",
      "status": "renamed"
    }
  ],

  "chapters": [
    {
      "num": "00", "slug": "preface", "title": "Preface",
      "prev_slug": "preface", "prev_title": "Preface",
      "era_id": null, "prev_era_id": null, "era_label": "before the lecture",
      "concept": "The book's two operating concepts",
      "teaser": "Not a verdict on individuals but a tracing of the structures that recruit them.",
      "pitch": "An archival encounter, the naming of the two operating concepts — quantitative chauvinism and lebensraum imaginaries — and a politically direct closing.",
      "summary": "The preface names the book's two co-evolving concepts. Quantitative chauvinism is the epistemic infrastructure; lebensraum imaginaries are the political projects that infrastructure serves. It distinguishes the analytic target (recurring imaginaries) from a verdict on any individual, and frames inoculation as anticipatory recognition of the moves by which numerical claims become moral permission structures.",
      "key_terms": ["quantitative chauvinism", "lebensraum imaginaries", "inoculation"],
      "source": "pdf", "status": "unchanged"
    },
    {
      "num": "01", "slug": "01-boulder", "title": "Boulder",
      "prev_slug": "01-boulder", "prev_title": "Boulder",
      "era_id": "prelude", "prev_era_id": "prelude", "era_label": "the case",
      "concept": "Quantitative chauvinism & lebensraum imaginaries",
      "teaser": "A progressive city builds the most elaborate growth-control machinery in America — and ends up whiter than the state around it.",
      "pitch": "Boulder, Colorado: a nominally progressive community where conservation slid gradually into exclusion, each step looking like responsible stewardship from the inside.",
      "summary": "Boulder introduces the book's two operating concepts through a hundred years of its own institutional history: the Colorado Chautauqua of 1898, the Olmsted Report of 1910, the Blue Line of 1959, the carrying-capacity ordinances of the 1970s. A nominally progressive community built one of the most elaborate growth-management apparatuses in the country — and produced a city that was, by 2020, 83% non-Hispanic white in a state two-thirds so. The slide from conservation into exclusion was gradual enough that each step looked, from the inside, like responsible stewardship.",
      "key_terms": ["Blue Line", "carrying capacity", "Olmsted Report"],
      "source": "pdf+landing.js", "status": "unchanged"
    },
    {
      "num": "02", "slug": "02-the-inheritance", "title": "The Inheritance",
      "prev_slug": null, "prev_title": null,
      "era_id": null, "prev_era_id": null, "era_label": "1900 – 1968",
      "concept": "The architecture, already built",
      "teaser": "Before Bartlett ever picked up the chalk, the apparatus, the vocabulary, and the audience were already in place.",
      "pitch": "The eugenics apparatus, the German science of Lebensraum, the conservation movement, and the postwar population-concern community — the formation Bartlett's lecture entered, already assembled.",
      "summary": "Bartlett's lecture was not an original act of creation; it entered a formation assembled across the first half of the twentieth century. Four currents converge: the institutional eugenics apparatus at Cold Spring Harbor, codified through sterilization regimes after Buck v. Bell; the German science of Lebensraum (Friedrich Ratzel to Rudolf Kjellén to Karl Haushofer); the American conservation movement, sharing donors and personnel with eugenics through Madison Grant and Henry Fairfield Osborn; and the postwar population-concern community — the Population Council, Paul Ehrlich, Garrett Hardin, the Club of Rome.",
      "key_terms": ["Lebensraum", "eugenics apparatus", "conservation movement", "population-concern community"],
      "source": "landing.js", "status": "new"
    },
    {
      "num": "03", "slug": "03-the-bottle", "title": "The Bottle",
      "prev_slug": "02-the-free-fall", "prev_title": "The Free Fall",
      "era_id": "bottle", "prev_era_id": "free_fall", "era_label": "1968 – 1994",
      "concept": "Domesticated scientism",
      "teaser": "He gave the same lecture 1,742 times. Each time, arithmetic quietly became obligation.",
      "pitch": "Bartlett's bacteria-in-a-bottle lecture turned exponential arithmetic into environmental common sense — the chapter names the mechanism: domesticated scientism.",
      "summary": "In the late 1960s the Cold War's ambient dread found a new target. Ehrlich's Population Bomb sold three million copies; Hardin's lifeboat ethics argued some must drown so others survive. Bartlett's contribution worked at a different register — it didn't predict famine, it taught arithmetic, and made the math feel like insight and the insight feel like obligation. This chapter names the mechanism — domesticated scientism — by which exponential arithmetic was naturalized as ecology, and ends on the 1995 exchange where the movement's exclusionary logic first surfaced as a dispute.",
      "key_terms": ["domesticated scientism", "exponential curve", "Population Bomb", "lifeboat ethics"],
      "source": "landing.js", "status": "renamed+renumbered"
    },
    {
      "num": "04", "slug": "04-the-quarantine", "title": "The Quarantine",
      "prev_slug": "03-the-quarantine", "prev_title": "The Quarantine",
      "era_id": "quarantine", "prev_era_id": "quarantine", "era_label": "1995 – 2008",
      "concept": "Agnotological infrastructuring",
      "teaser": "After Cairo, the movement lost its license — so it built a new one out of footnotes.",
      "pitch": "With fertility control delegitimized after Cairo, immigration restriction became the residual lever, laundered through the aesthetics of neutral policy expertise.",
      "summary": "The 1994 Cairo conference replaced coercive population control with women's reproductive autonomy. For the population-concern community it was a catastrophe — but the anxieties didn't vanish, they migrated. With fertility control delegitimized, immigration restriction became the residual lever. John Tanton built a network that laundered nativist conclusions through the aesthetics of neutral policy expertise: fiscal impact statements that turned 'should we admit these people?' into 'what do these people cost?' The chapter calls the method agnotological infrastructuring — the manufacture of ignorance through parallel institutions.",
      "key_terms": ["agnotological infrastructuring", "fiscal impact statement", "Tanton network", "Cairo 1994"],
      "source": "landing.js", "status": "renumbered"
    },
    {
      "num": "05", "slug": "05-the-swarm", "title": "The Swarm",
      "prev_slug": "04-the-swarm", "prev_title": "The Swarm",
      "era_id": "swarm", "prev_era_id": "swarm", "era_label": "2009 – 2024",
      "concept": "Demographic engineering",
      "teaser": "A federal press release became one of the most-cited numbers in a mass-shooter's manifesto.",
      "pitch": "The 2008 Census crossover chart traveled, stripped of its caveats, from a federal agency into the 'great replacement' narrative.",
      "summary": "In 2008 the Census Bureau announced that non-Hispanic whites would become a minority by 2042, with a chart of converging lines. The projection was conditional; the chart was not. Stripped of caveats by screenshots and memes, the crossover chart traveled from a federal agency to chan-boards to the 'great replacement' narrative and into manifestos. Federal demographers had produced, with unimpeachable authority, exactly the object restrictionists could never have manufactured themselves. The chapter calls the operation demographic engineering.",
      "key_terms": ["demographic engineering", "crossover chart", "great replacement", "majority-minority"],